{"artifacts":{"analytic_trace":{"ach_matrix":null,"analysis_id":"portable-light-zoned","calculations":[{"caveats":["Difference between reported clock values; physical latency is not established.","Clock alignment, event meaning, and observation coverage require independent validation."],"id":"elapsed","operation":"reported_interval","physical_latency_established":false,"status":"resolved","unit":"seconds","value":2.5},{"caveats":[],"id":"remaining","operation":"difference","status":"resolved","unit":"records","value":9},{"caveats":[],"id":"per_batch","operation":"ratio","status":"resolved","unit":"records per batch","value":3}],"coherence":null,"content_hash":"a074f3bc3c55c3caf2dcc6b1dc66203a661bfbd2ef34411e4d823cbe051089b1","diagnostics":[{"code":"judgment_not_verified","message":"Judgment is analyst-authored; engine validation does not establish its factual truth.","path":"$.judgment","remediation":"","severity":"warning"}],"engine_version":"1.1.0","request":{"analysis_id":"portable-light-zoned","assumptions":["Source records are supplied assertions; collection completeness is unverified."],"calculations":[{"end_observation_id":"light.receive","id":"elapsed","operation":"reported_interval","start_observation_id":"light.send"},{"id":"remaining","operands":[15,6],"operation":"difference","unit":"records"},{"id":"per_batch","operands":[9,3],"operation":"ratio","unit":"records per batch"}],"evidence":[],"hypotheses":[],"judgment":{"confidence":{"level":"low","reasoning":"The two clock domains have no established synchronization bounds."},"observation_ids":["light.send","light.receive"],"summary":"The reported clocks differ by 2.5 seconds; transport latency remains unestablished."},"limitations":["This fixture tests deterministic contracts, not whether a causal explanation is true."],"mode":"LIGHT","observations":[{"clock_domain":"sender","id":"light.send","parse_status":"parsed","raw":"send report at 10:00:00.125Z","record_sha256":"7e500de220ebe30c2cf41a263a565a06f3f73a76e5c3f8ea4ac31842af00dd6f","reliability":"unknown","schema_version":"1","source":"sender.log","timestamp":"2026-09-09T10:00:00.125Z","timestamp_semantics":"send-report","timestamp_uncertainty_seconds":null},{"clock_domain":"receiver","id":"light.receive","parse_status":"parsed","raw":"receive report at 12:00:02.625+02:00","record_sha256":"9eed05bec182be454d555d23f828d4522a4de446b367bc4c42cdc23f26646557","reliability":"F","schema_version":"1","source":"receiver.log","timestamp":"2026-09-09T12:00:02.625+02:00","timestamp_semantics":"receive-report","timestamp_uncertainty_seconds":null}],"question":"What is the supplied reported-clock interval?","relationship":"unspecified","revision":2,"rule_ids":[],"schema_version":"1","submode":"GENERAL","tasks":[],"timeline_options":{"gap_threshold_seconds":300,"rapid_threshold_seconds":1}},"revision":2,"schema_version":"1","timeline":{"analysis":{"actors":{},"caveats":["Source timestamps are source assertions; reported-clock intervals do not establish physical latency or causation.","Collection completeness is not established; a reported-clock gap is not evidence that no event occurred.","At least one timestamp uncertainty is unknown, not zero."],"gaps":[],"parse_counts":{"parsed":2,"rejected":0,"unparsed":0},"rapid_succession":[],"resolved_events":2,"tag_sequences":[],"time_range":{"first":"2026-09-09T10:00:00.125000+00:00","last":"2026-09-09T10:00:02.625000+00:00"},"total_events":2,"unresolved_events":0},"events":[{"actor":null,"address_mentions":[],"clock_domain":"sender","dependency_groups":[],"description":"send report at 10:00:00.125Z","id":"light.send","line_number":null,"origin_id":null,"parse_error":null,"parse_status":"parsed","parser":"unknown","raw":"send report at 10:00:00.125Z","raw_bytes_base64":null,"record_sha256":"7e500de220ebe30c2cf41a263a565a06f3f73a76e5c3f8ea4ac31842af00dd6f","reliability":"unknown","reliability_reason":null,"source":"sender.log","source_id":null,"tags":[],"target":null,"timestamp":"2026-09-09T10:00:00.125Z","timestamp_context":{},"timestamp_resolution_error":null,"timestamp_semantics":"send-report","timestamp_uncertainty_seconds":null,"timestamp_utc":"2026-09-09T10:00:00.125000+00:00"},{"actor":null,"address_mentions":[],"clock_domain":"receiver","dependency_groups":[],"description":"receive report at 12:00:02.625+02:00","id":"light.receive","line_number":null,"origin_id":null,"parse_error":null,"parse_status":"parsed","parser":"unknown","raw":"receive report at 12:00:02.625+02:00","raw_bytes_base64":null,"record_sha256":"9eed05bec182be454d555d23f828d4522a4de446b367bc4c42cdc23f26646557","reliability":"F","reliability_reason":null,"source":"receiver.log","source_id":null,"tags":[],"target":null,"timestamp":"2026-09-09T12:00:02.625+02:00","timestamp_context":{},"timestamp_resolution_error":null,"timestamp_semantics":"receive-report","timestamp_uncertainty_seconds":null,"timestamp_utc":"2026-09-09T10:00:02.625000+00:00"}],"gap_threshold_seconds":300,"rapid_threshold_seconds":1,"schema_version":"1"}},"decision_card":{"analysis_id":"portable-light-zoned","assessment_status":"not_evaluated","calculations":[{"caveats":["Difference between reported clock values; physical latency is not established.","Clock alignment, event meaning, and observation coverage require independent validation."],"id":"elapsed","operation":"reported_interval","physical_latency_established":false,"status":"resolved","unit":"seconds","value":2.5},{"caveats":[],"id":"remaining","operation":"difference","status":"resolved","unit":"records","value":9},{"caveats":[],"id":"per_batch","operation":"ratio","status":"resolved","unit":"records per batch","value":3}],"confidence":{"level":"low","reasoning":"The two clock domains have no established synchronization bounds."},"content_hash":"a074f3bc3c55c3caf2dcc6b1dc66203a661bfbd2ef34411e4d823cbe051089b1","implications":[],"likelihood":null,"limitations":["This fixture tests deterministic contracts, not whether a causal explanation is true."],"question":"What is the supplied reported-clock interval?","revision":2,"schema_version":"1","summary":"The reported clocks differ by 2.5 seconds; transport latency remains unestablished."},"tasking_view":null},"diagnostics":[{"code":"judgment_not_verified","message":"Judgment is analyst-authored; engine validation does not establish its factual truth.","path":"$.judgment","remediation":"","severity":"warning"}],"engine_version":"1.1.0","schema_version":"1","status":"ok"}
